{
  "$schema": "../../schemas/data-manifest.schema.json",
  "schema_version": "data-manifest.v1",
  "manifest_id": "manifest:ch-structural-survey-religion:ch:2010-2024:bfs-canton:3cb6fffe4689",
  "dataset_id": "ch-structural-survey-religion:ch:2010-2024:bfs-canton",
  "dataset_version_id": "ch-structural-survey-religion:ch:2010-2024:bfs-canton:3cb6fffe4689",
  "manifest_sha256": null,
  "supersedes_manifest_id": null,
  "superseded_by_manifest_id": null,
  "dataset_family": "ch-structural-survey-religion",
  "dataset_role": "public_product",
  "scope": {
    "level": "country",
    "country_codes": [
      "CH"
    ],
    "snapshot_date": null,
    "snapshot_anchor": null,
    "pipeline_stage": "public"
  },
  "created_at": "2026-07-09T23:39:54Z",
  "created_by": "scripts/build_ch_area_summary.R",
  "pipeline": {
    "script": "scripts/build_ch_area_summary.R",
    "git_commit": "11c2845",
    "command": "Rscript scripts/build_ch_area_summary.R",
    "parameters": {
      "product": "survey",
      "boundary_set": "ch-canton-2026-swissboundaries3d",
      "construct_split": "Census full-count affiliation and structural-survey age-15-plus weighted estimates are shipped as separate area-summary products.",
      "raw_cache_durable_uris": [
        "gs://pow-research-data/raw_sources/ch_religion/"
      ]
    },
    "software_versions": {
      "r": "4.6.1",
      "sf": "1.1.1",
      "readxl": "1.5.0",
      "jsonlite": "2.0.0",
      "mapshaper": "npx --yes mapshaper"
    }
  },
  "source": {
    "provider": "Federal Statistical Office (FSO/BFS); swisstopo",
    "source_dataset_ids": [
      "bfs-je-d-01080202-structural-survey-religion-canton-2010-2024",
      "swisstopo-swissboundaries3d-cantons-2026-01"
    ],
    "source_urls": [
      "https://opendata.swiss/api/3/action/package_show?id=religionszugehorigkeit-nach-grossregion-und-kanton",
      "https://dam-api.bfs.admin.ch/hub/api/dam/assets/36347568",
      "https://dam-api.bfs.admin.ch/hub/api/dam/assets/36347568/master",
      "https://opendata.swiss/api/3/action/package_show?id=swissboundaries3d",
      "https://data.geo.admin.ch/api/stac/v0.9/collections/ch.swisstopo.swissboundaries3d/items/swissboundaries3d_2026-01",
      "https://data.geo.admin.ch/ch.swisstopo.swissboundaries3d/swissboundaries3d_2026-01/swissboundaries3d_2026-01_2056_5728.gpkg.zip",
      "https://opendata.swiss/en/terms-of-use/"
    ],
    "retrieved_at": "2026-07-09T23:39:54Z",
    "licence": "opendata.swiss OPEN-BY-ASK / terms_by_ask: non-commercial reuse is allowed with source attribution; commercial reuse requires permission from the data owner. Boundary source: opendata.swiss OPEN-BY / terms_by: free use with source attribution.",
    "citation": "Federal Statistical Office, structural survey, religious affiliation by major region and canton, 2010-2024; swisstopo, swissBOUNDARIES3D 2026-01."
  },
  "input_manifests": [],
  "durable_files": [
    {
      "uri": "repo:apps/regions/ch/data/ch_canton_2026.geojson",
      "storage_provider": "other",
      "format": "geojson",
      "bytes": 755147,
      "sha256": "7a044179ba1015e02f1fa1e1dc860e68a439a20e1ab1cfc42a408736f5938144",
      "row_count": null,
      "feature_count": 26,
      "content": "simplified canton boundary",
      "privacy": "public",
      "licence_status": "accepted"
    },
    {
      "uri": "repo:apps/regions/ch/data/area_summary_canton_survey.json",
      "storage_provider": "other",
      "format": "json",
      "bytes": 477497,
      "sha256": "d8b1b272d82470c46ff56c1c39bef9f18fda0cabfb69118d542966f59994c4c8",
      "row_count": 390,
      "feature_count": null,
      "content": "area-summary JSON",
      "privacy": "public",
      "licence_status": "accepted"
    },
    {
      "uri": "repo:apps/regions/ch/data/area_summary_canton_survey.csv",
      "storage_provider": "other",
      "format": "csv",
      "bytes": 232119,
      "sha256": "8e7a7065b021b995080a7e607dcf6553c173797f7bc42115f61bc9d0a0393963",
      "row_count": 390,
      "feature_count": null,
      "content": "area-summary CSV",
      "privacy": "public",
      "licence_status": "accepted"
    }
  ],
  "partitions": [],
  "stats": {
    "row_count": 390,
    "canton_count": 26,
    "year_count": 15,
    "years": "2010-2024",
    "total_reconciliation_max_abs_raw_difference": 1.86264514923096e-09,
    "no_religion_reconciliation_max_abs_raw_difference": 3,
    "suppressed_unknown_canton_years": 23,
    "boundary_keep_percent": 20,
    "boundary_bytes": 755147,
    "construct": "structural_survey_weighted_age15plus_estimate"
  },
  "local_cache_hint": "data/raw/ch_religion",
  "validation": {
    "status": "passed_with_warnings",
    "commands": [
      "Rscript scripts/build_ch_area_summary.R",
      "Rscript -e 'jsonlite::validate(readChar(\"apps/regions/ch/data/area_summary_canton_census.json\", file.info(\"apps/regions/ch/data/area_summary_canton_census.json\")$size))'",
      "Rscript -e 'jsonlite::validate(readChar(\"apps/regions/ch/data/area_summary_canton_survey.json\", file.info(\"apps/regions/ch/data/area_summary_canton_survey.json\")$size))'"
    ],
    "warnings": [
      "Structural-survey rows are weighted sample estimates for the resident population aged 15+ and are not census counts.",
      "The source workbook includes confidence intervals by category, but the legacy area-summary row schema has no CI columns.",
      "Survey canton total and no-religion estimates are checked against the workbook national row with a 5-person tolerance for weighted-estimate decimal residuals.",
      "23 canton-year rows have suppressed unknown-affiliation cells, so religious_affiliation_count and religious_affiliation_percent are null for those rows."
    ],
    "notes": "The survey product is separate from the census product because the denominator, measurement design and uncertainty differ. Canton total and no-religion estimates are compared with the workbook's national row before integer rounding; small decimal residuals reflect weighted estimates, and suppressed unknown-affiliation cells prevent exact canton reconstruction of the affiliation-excluding-unknown numerator in the affected rows."
  },
  "privacy": "public",
  "licence_status": "accepted",
  "downstream_status": "public",
  "notes": "The survey product is separate from the census product because the denominator, measurement design and uncertainty differ. Canton total and no-religion estimates are compared with the workbook's national row before integer rounding; small decimal residuals reflect weighted estimates, and suppressed unknown-affiliation cells prevent exact canton reconstruction of the affiliation-excluding-unknown numerator in the affected rows."
}
