{
  "$schema": "../../schemas/data-manifest.schema.json",
  "schema_version": "data-manifest.v1",
  "manifest_id": "manifest:osm-pow:nz:2013-2025:places-to-check:ef64ba809ced",
  "dataset_id": "osm-pow:nz:2013-2025:places-to-check",
  "dataset_version_id": "osm-pow:nz:2013-2025:places-to-check:ef64ba809ced",
  "manifest_sha256": "f6a406f0a9909d4205970c702f06b7fed0025df57b5f2f22af54e0fcbdb3804a",
  "supersedes_manifest_id": null,
  "superseded_by_manifest_id": null,
  "dataset_family": "osm-pow",
  "dataset_role": "intermediate_lead",
  "scope": {
    "level": "country",
    "country_codes": [
      "NZ"
    ],
    "snapshot_date": null,
    "snapshot_anchor": "09-01",
    "pipeline_stage": "review_queue"
  },
  "created_at": "2026-05-07T10:20:02Z",
  "created_by": "scripts/build_nz_osm_temporal_candidates.R",
  "pipeline": {
    "script": "scripts/build_nz_osm_temporal_candidates.R",
    "git_commit": "d8ef6d820c75a028471b24c61a2a81255c51b725",
    "command": "Rscript scripts/build_nz_osm_temporal_candidates.R --no-fetch",
    "parameters": {
      "years": "2013:2025",
      "task_years": "2013,2018,2023",
      "snapshot_anchor": "09-01",
      "types": "node,way",
      "fetch": false
    },
    "software_versions": {
      "R": "4.6.0"
    }
  },
  "source": {
    "provider": "OpenStreetMap via ohsome API",
    "source_dataset_ids": [
      "osm-ohsome-elements-centroid"
    ],
    "source_urls": [
      "https://api.ohsome.org/v1/elements/centroid"
    ],
    "retrieved_at": "2026-05-07T10:20:02Z",
    "licence": "ODbL-1.0",
    "citation": "OpenStreetMap contributors; ohsome API."
  },
  "input_manifests": [],
  "durable_files": [
    {
      "uri": "https://drive.google.com/file/d/1-69AbXcEvKDswgMYxCjg4sdeAP4haClY/view?usp=drivesdk",
      "storage_provider": "google_drive",
      "format": "tar.gz",
      "bytes": 8314017,
      "sha256": "ef64ba809ced0a6b0bb16550d8764fb04dfb51fac2c9b74e1ffdb502cbfb4de9",
      "content_sha256": null,
      "row_count": null,
      "feature_count": null,
      "content": "Packaged NZ OSM 2013-2025 raw annual snapshots, cleaned and normalised yearly files, temporal places-to-check CSV/GeoJSON, OSM date-tag places-to-check CSV/GeoJSON, and run manifest.",
      "privacy": "project_private",
      "licence_status": "accepted"
    }
  ],
  "partitions": [
    {
      "partition_id": "NZ",
      "partition_type": "country",
      "country_code": "NZ",
      "file_uri": "https://drive.google.com/file/d/1-69AbXcEvKDswgMYxCjg4sdeAP4haClY/view?usp=drivesdk",
      "sha256": "ef64ba809ced0a6b0bb16550d8764fb04dfb51fac2c9b74e1ffdb502cbfb4de9",
      "row_count": 4777,
      "feature_count": null
    }
  ],
  "stats": {
    "temporal_candidate_rows": 4777,
    "date_tag_places_to_check_rows": 1438,
    "snapshot_count": 13,
    "cleaned_2013": 775,
    "cleaned_2018": 2012,
    "cleaned_2023": 3335,
    "cleaned_2025": 3350
  },
  "local_cache_hint": "data/intermediate/nz_osm_temporal/",
  "validation": {
    "status": "passed_with_warnings",
    "commands": [
      "Rscript scripts/build_nz_osm_temporal_candidates.R --no-fetch",
      "tar -tzf exports/nz_osm_temporal_2026-05-07/nz_osm_temporal_2013-2025_2026-05-07.tar.gz"
    ],
    "warnings": [
      "Rows are OSM-derived places to check, not accepted historical worship-use evidence."
    ],
    "notes": "Generated from cached raw ohsome files already present in the temporary working directory, then copied to project-owned Google Drive and checked against the local archive SHA-256."
  },
  "privacy": "project_private",
  "licence_status": "accepted",
  "downstream_status": "lead",
  "notes": "Drive folder: https://drive.google.com/drive/folders/1hOpbvOHPG2JjwavT7IQc9gJirOpru2hb. This is an intermediate list of places to check for review-task generation, not accepted historical worship-use evidence."
}
